{"recoveryId":"recovery_dev_run_persist_001_2","schemaVersion":"1.0.0","sourceRunRef":"dev_run_persist_001","recoveredRunRef":"dev_run_persist_001_recovery_2","status":"restarted_from_received","governanceRecheckRequired":true,"restartState":"received","replay":{"replayId":"replay_dev_run_persist_001","schemaVersion":"1.0.0","runRef":"dev_run_persist_001","status":"verified","eventCount":9,"lastEventHash":"cccccccccccccccccccccccccccccccccccccccccccccccccccccccccccccccc","corruptionFindings":[],"recoveryAllowed":true},"reason":"Verified recovery restarted the full read-only state machine from received."}
